{
  "version": "0.2.0",
  "language": "pl",
  "source": "https://automaty.bet/slownik-kasynowy/",
  "maintainer": "Automaty.bet",
  "maintainerUrl": "https://automaty.bet",
  "license": "MIT (code) + CC-BY-4.0 (content)",
  "lastUpdate": "2026-05-19",
  "categories": [
    { "id": "bonusy", "name": "Bonusy i promocje", "icon": "🎁" },
    { "id": "mechanika", "name": "Mechanika gier", "icon": "⚙️" },
    { "id": "typy-gier", "name": "Typy gier", "icon": "🎰" },
    { "id": "platnosci", "name": "Płatności", "icon": "💳" },
    { "id": "regulacje", "name": "Regulacje i licencje", "icon": "⚖️" },
    { "id": "odpowiedzialna-gra", "name": "Odpowiedzialna gra", "icon": "🛡️" },
    { "id": "technologia", "name": "Technologia", "icon": "🔐" },
    { "id": "branza", "name": "Branża i marketing", "icon": "📊" }
  ],
  "authors": [
    {
      "name": "Konrad Zapolski",
      "role": "Specjalista ds. bonusów i promocji",
      "profileUrl": "https://automaty.bet/o-redakcji/konrad-zapolski/"
    },
    {
      "name": "Tomasz Zieliński",
      "role": "Analityk gier kasynowych",
      "profileUrl": "https://automaty.bet/o-redakcji/tomasz-zielinski/"
    },
    {
      "name": "Malwina Mazur",
      "role": "Ekspertka ds. bezpieczeństwa i płatności",
      "profileUrl": "https://automaty.bet/o-redakcji/malwina-mazur/"
    },
    {
      "name": "Michał Kowalczyk",
      "role": "Redaktor Naczelny",
      "profileUrl": "https://automaty.bet/o-redakcji/michal-kowalczyk/"
    }
  ],
  "terms": [
    {
      "id": "wagering",
      "name": "Wagering (wymagania obrotu)",
      "alternativeNames": ["wymagania obrotu", "playthrough", "obrót bonusowy", "WR"],
      "category": "bonusy",
      "author": "Konrad Zapolski",
      "shortDef": "",
      "fullDef": "",
      "example": "",
      "relatedTerms": [],
      "relatedUrl": "https://automaty.bet/jak-oceniamy-kasyna-online/",
      "sourceUrl": "https://automaty.bet/slownik-kasynowy/#wagering",
      "lastUpdate": null
    },
    {
      "id": "bonus-powitalny",
      "name": "Bonus powitalny",
      "alternativeNames": ["welcome bonus", "bonus na start", "powitalny pakiet"],
      "category": "bonusy",
      "author": "Konrad Zapolski",
      "shortDef": "",
      "fullDef": "",
      "example": "",
      "relatedTerms": [],
      "relatedUrl": "https://automaty.bet/kasyno-online/",
      "sourceUrl": "https://automaty.bet/slownik-kasynowy/#bonus-powitalny",
      "lastUpdate": null
    },
    {
      "id": "free-spins",
      "name": "Free spins (darmowe spiny)",
      "alternativeNames": ["darmowe spiny", "FS bonus", "spiny promocyjne", "free spins promo"],
      "category": "bonusy",
      "author": "Konrad Zapolski",
      "shortDef": "",
      "fullDef": "",
      "example": "",
      "relatedTerms": [],
      "relatedUrl": "https://automaty.bet/sloty-online/",
      "sourceUrl": "https://automaty.bet/slownik-kasynowy/#free-spins",
      "lastUpdate": null
    },
    {
      "id": "bonus-bez-depozytu",
      "name": "Bonus bez depozytu (no deposit)",
      "alternativeNames": ["no deposit bonus", "NDB", "bonus na start bez wpłaty"],
      "category": "bonusy",
      "author": "Konrad Zapolski",
      "shortDef": "",
      "fullDef": "",
      "example": "",
      "relatedTerms": [],
      "relatedUrl": "https://automaty.bet/kasyno-online/",
      "sourceUrl": "https://automaty.bet/slownik-kasynowy/#bonus-bez-depozytu",
      "lastUpdate": null
    },
    {
      "id": "sticky-bonus",
      "name": "Sticky bonus",
      "alternativeNames": ["bonus lepki", "non-cashable bonus", "bonus niewypłacalny"],
      "category": "bonusy",
      "author": "Konrad Zapolski",
      "shortDef": "",
      "fullDef": "",
      "example": "",
      "relatedTerms": [],
      "relatedUrl": "https://automaty.bet/jak-oceniamy-kasyna-online/",
      "sourceUrl": "https://automaty.bet/slownik-kasynowy/#sticky-bonus",
      "lastUpdate": null
    },
    {
      "id": "non-sticky-bonus",
      "name": "Non-sticky bonus",
      "alternativeNames": ["bonus niesticky", "cashable bonus", "bonus rozdzielony"],
      "category": "bonusy",
      "author": "Konrad Zapolski",
      "shortDef": "",
      "fullDef": "",
      "example": "",
      "relatedTerms": [],
      "relatedUrl": "https://automaty.bet/jak-oceniamy-kasyna-online/",
      "sourceUrl": "https://automaty.bet/slownik-kasynowy/#non-sticky-bonus",
      "lastUpdate": null
    },
    {
      "id": "cashback",
      "name": "Cashback",
      "alternativeNames": ["zwrot gotówki", "cashback bonus", "rebate"],
      "category": "bonusy",
      "author": "Konrad Zapolski",
      "shortDef": "",
      "fullDef": "",
      "example": "",
      "relatedTerms": [],
      "relatedUrl": "https://automaty.bet/jak-oceniamy-kasyna-online/",
      "sourceUrl": "https://automaty.bet/slownik-kasynowy/#cashback",
      "lastUpdate": null
    },
    {
      "id": "reload-bonus",
      "name": "Reload bonus",
      "alternativeNames": ["bonus reload", "bonus za doładowanie", "bonus na drugi depozyt"],
      "category": "bonusy",
      "author": "Konrad Zapolski",
      "shortDef": "",
      "fullDef": "",
      "example": "",
      "relatedTerms": [],
      "relatedUrl": "https://automaty.bet/kasyno-online/",
      "sourceUrl": "https://automaty.bet/slownik-kasynowy/#reload-bonus",
      "lastUpdate": null
    },
    {
      "id": "max-win-bonus",
      "name": "Maksymalna wygrana z bonusu (max win)",
      "alternativeNames": ["max win cap", "limit wygranej z bonusu", "maksymalna wypłata z bonusu"],
      "category": "bonusy",
      "author": "Konrad Zapolski",
      "shortDef": "",
      "fullDef": "",
      "example": "",
      "relatedTerms": [],
      "relatedUrl": "https://automaty.bet/jak-oceniamy-kasyna-online/",
      "sourceUrl": "https://automaty.bet/slownik-kasynowy/#max-win-bonus",
      "lastUpdate": null
    },
    {
      "id": "max-stawka-bonus",
      "name": "Maksymalna stawka podczas bonusu",
      "alternativeNames": ["max bet rule", "limit stawki bonusowej", "max bet podczas obrotu"],
      "category": "bonusy",
      "author": "Konrad Zapolski",
      "shortDef": "",
      "fullDef": "",
      "example": "",
      "relatedTerms": [],
      "relatedUrl": "https://automaty.bet/jak-oceniamy-kasyna-online/",
      "sourceUrl": "https://automaty.bet/slownik-kasynowy/#max-stawka-bonus",
      "lastUpdate": null
    },
    {
      "id": "referral-bonus",
      "name": "Bonus za polecenie (referral)",
      "alternativeNames": ["refer-a-friend", "bonus za polecenie znajomego", "RAF bonus"],
      "category": "bonusy",
      "author": "Konrad Zapolski",
      "shortDef": "",
      "fullDef": "",
      "example": "",
      "relatedTerms": [],
      "relatedUrl": "https://automaty.bet/kasyno-online/",
      "sourceUrl": "https://automaty.bet/slownik-kasynowy/#referral-bonus",
      "lastUpdate": null
    },
    {
      "id": "vip-program",
      "name": "VIP / program lojalnościowy",
      "alternativeNames": ["program lojalnościowy", "loyalty program", "klub VIP"],
      "category": "bonusy",
      "author": "Konrad Zapolski",
      "shortDef": "",
      "fullDef": "",
      "example": "",
      "relatedTerms": [],
      "relatedUrl": "https://automaty.bet/jak-oceniamy-kasyna-online/",
      "sourceUrl": "https://automaty.bet/slownik-kasynowy/#vip-program",
      "lastUpdate": null
    },
    {
      "id": "comp-points",
      "name": "Comp points (punkty lojalnościowe)",
      "alternativeNames": ["punkty lojalnościowe", "loyalty points", "punkty compowe"],
      "category": "bonusy",
      "author": "Konrad Zapolski",
      "shortDef": "",
      "fullDef": "",
      "example": "",
      "relatedTerms": [],
      "relatedUrl": "https://automaty.bet/jak-oceniamy-kasyna-online/",
      "sourceUrl": "https://automaty.bet/slownik-kasynowy/#comp-points",
      "lastUpdate": null
    },
    {
      "id": "free-chips",
      "name": "Free chips",
      "alternativeNames": ["darmowe żetony", "free chip", "bonus żetonowy"],
      "category": "bonusy",
      "author": "Konrad Zapolski",
      "shortDef": "",
      "fullDef": "",
      "example": "",
      "relatedTerms": [],
      "relatedUrl": "https://automaty.bet/kasyno-online/",
      "sourceUrl": "https://automaty.bet/slownik-kasynowy/#free-chips",
      "lastUpdate": null
    },
    {
      "id": "match-bonus",
      "name": "Match bonus",
      "alternativeNames": ["bonus procentowy", "deposit match", "bonus dopasowany"],
      "category": "bonusy",
      "author": "Konrad Zapolski",
      "shortDef": "",
      "fullDef": "",
      "example": "",
      "relatedTerms": [],
      "relatedUrl": "https://automaty.bet/kasyno-online/",
      "sourceUrl": "https://automaty.bet/slownik-kasynowy/#match-bonus",
      "lastUpdate": null
    },
    {
      "id": "high-roller-bonus",
      "name": "High roller bonus",
      "alternativeNames": ["bonus dla high rollerów", "VIP deposit bonus", "bonus na wysokie wpłaty"],
      "category": "bonusy",
      "author": "Konrad Zapolski",
      "shortDef": "",
      "fullDef": "",
      "example": "",
      "relatedTerms": [],
      "relatedUrl": "https://automaty.bet/kasyno-online/",
      "sourceUrl": "https://automaty.bet/slownik-kasynowy/#high-roller-bonus",
      "lastUpdate": null
    },
    {
      "id": "turniej-kasynowy",
      "name": "Turniej kasynowy",
      "alternativeNames": ["casino tournament", "slot tournament", "turniej slotowy"],
      "category": "bonusy",
      "author": "Konrad Zapolski",
      "shortDef": "",
      "fullDef": "",
      "example": "",
      "relatedTerms": [],
      "relatedUrl": "https://automaty.bet/sloty-online/",
      "sourceUrl": "https://automaty.bet/slownik-kasynowy/#turniej-kasynowy",
      "lastUpdate": null
    },
    {
      "id": "freeroll",
      "name": "Freeroll",
      "alternativeNames": ["freeroll tournament", "darmowy turniej", "turniej bez wpisowego"],
      "category": "bonusy",
      "author": "Konrad Zapolski",